[
  {
    "id": "chatcmpl-fixture-stream-0001",
    "object": "chat.completion.chunk",
    "created": 1700000000,
    "model": "test-model-b",
    "choices": [
      {
        "index": 0,
        "delta": {
          "role": "assistant",
          "content": ""
        },
        "finish_reason": null
      }
    ]
  },
  {
    "id": "chatcmpl-fixture-stream-0001",
    "object": "chat.completion.chunk",
    "created": 1700000000,
    "model": "test-model-b",
    "choices": [
      {
        "index": 0,
        "delta": {
          "content": "Synthetic "
        },
        "finish_reason": null
      }
    ]
  },
  {
    "id": "chatcmpl-fixture-stream-0001",
    "object": "chat.completion.chunk",
    "created": 1700000000,
    "model": "test-model-b",
    "choices": [
      {
        "index": 0,
        "delta": {
          "content": "streamed "
        },
        "finish_reason": null
      }
    ]
  },
  {
    "id": "chatcmpl-fixture-stream-0001",
    "object": "chat.completion.chunk",
    "created": 1700000000,
    "model": "test-model-b",
    "choices": [
      {
        "index": 0,
        "delta": {
          "content": "reply."
        },
        "finish_reason": null
      }
    ]
  },
  {
    "id": "chatcmpl-fixture-stream-0001",
    "object": "chat.completion.chunk",
    "created": 1700000000,
    "model": "test-model-b",
    "choices": [
      {
        "index": 0,
        "delta": {},
        "finish_reason": null
      }
    ]
  },
  {
    "id": "chatcmpl-fixture-stream-0001",
    "object": "chat.completion.chunk",
    "created": 1700000000,
    "model": "test-model-b",
    "choices": [
      {
        "index": 0,
        "delta": {
          "tool_calls": [
            {
              "index": 0,
              "id": "call_fixture_stream_0",
              "type": "function",
              "function": {
                "name": "lookup_unit",
                "arguments": ""
              }
            }
          ]
        },
        "finish_reason": null
      }
    ]
  },
  {
    "id": "chatcmpl-fixture-stream-0001",
    "object": "chat.completion.chunk",
    "created": 1700000000,
    "model": "test-model-b",
    "choices": [
      {
        "index": 0,
        "delta": {
          "tool_calls": [
            {
              "index": 0,
              "function": {
                "arguments": "{\"region\":"
              }
            }
          ]
        },
        "finish_reason": null
      }
    ]
  },
  {
    "id": "chatcmpl-fixture-stream-0001",
    "object": "chat.completion.chunk",
    "created": 1700000000,
    "model": "test-model-b",
    "choices": [
      {
        "index": 0,
        "delta": {
          "tool_calls": [
            {
              "index": 0,
              "function": {
                "arguments": " \"synthetic-region-1\"}"
              }
            }
          ]
        },
        "finish_reason": null
      }
    ]
  },
  {
    "id": "chatcmpl-fixture-stream-0001",
    "object": "chat.completion.chunk",
    "created": 1700000000,
    "model": "test-model-b",
    "choices": [
      {
        "index": 0,
        "delta": {},
        "finish_reason": "tool_calls"
      }
    ],
    "usage": {
      "prompt_tokens": 210,
      "completion_tokens": 27,
      "total_tokens": 237,
      "prompt_tokens_details": {
        "cached_tokens": 160
      },
      "completion_tokens_details": {
        "reasoning_tokens": 9
      }
    }
  }
]
